{
  "schema_version": "adr049.package_contract_table.v1",
  "agent_id": "PV-A5",
  "generated_at": "2026-06-14",
  "source_priority": "code-primary-adr-secondary",
  "agent_scope": {
    "sections": [
      "13_cross_surface_registry_consistency",
      "99_omitted_or_discovered_contracts"
    ],
    "summary": "Section 13 registry consistency contracts plus discovered package-facing omissions not cleanly owned by sections 1-13."
  },
  "contracts": [
    {
      "id": "PV-13-001",
      "section": "13_cross_surface_registry_consistency",
      "title": "Block registry descriptors preserve package identity",
      "contract": "A package validator must derive block-package consistency from BlockRegistry descriptors, not live class references: entry-point blocks must produce BlockSpec rows with stable module/class identity, package_name, type_name aliases, and package metadata exposed through packages() and specs_by_package().",
      "status": "partial",
      "severity": "error",
      "environments": [
        "development",
        "production"
      ],
      "validator_profile": {
        "development": "error",
        "production": "block"
      },
      "applicability": {
        "candidate_surfaces": [
          "cross_surface_registry_consistency"
        ],
        "trigger": "after_candidate_declared_surfaces_are_loaded_into_dry_run_registries",
        "not_applicable_result": "not_applicable"
      },
      "code_evidence": [
        {
          "path": "src/scistudio/blocks/registry/__init__.py",
          "kind": "contains",
          "pattern": "class BlockSpec:",
          "symbol": "BlockSpec",
          "notes": "BlockSpec is the descriptor row used by registry consumers."
        },
        {
          "path": "src/scistudio/blocks/registry/__init__.py",
          "kind": "contains",
          "pattern": "class BlockRegistry:",
          "symbol": "BlockRegistry",
          "notes": "BlockRegistry owns package metadata and grouped spec accessors."
        },
        {
          "path": "src/scistudio/blocks/registry/__init__.py",
          "kind": "contains",
          "pattern": "def _scan_tier2(self) -> None:",
          "symbol": "_scan_tier2",
          "notes": "Public registry method delegates to the entry-point scan implementation."
        },
        {
          "path": "src/scistudio/blocks/registry/__init__.py",
          "kind": "contains",
          "pattern": "def specs_by_package(self) -> dict[str, list[BlockSpec]]:",
          "symbol": "BlockRegistry",
          "notes": "Registry exposes package grouping derived from BlockSpec.package_name."
        }
      ],
      "adr_evidence": [
        {
          "path": "docs/planning/package-validator-contract-survey-draft.md",
          "kind": "contains",
          "pattern": "BlockRegistry` entry-point scan accepts package tuples, plain block lists,",
          "notes": "Draft records current BlockRegistry package scan behavior."
        },
        {
          "path": "docs/planning/package-validator-contract-survey-draft.md",
          "kind": "contains",
          "pattern": "package metadata vs entry-point owner names need one combined pass.",
          "notes": "Draft identifies package metadata cross-surface consistency as incomplete."
        }
      ],
      "tests": [
        {
          "path": "tests/blocks/test_registry.py",
          "kind": "contains",
          "pattern": "def test_tuple_return_with_package_info(self) -> None:",
          "notes": "Tests package tuple scan behavior."
        },
        {
          "path": "tests/blocks/test_registry.py",
          "kind": "contains",
          "pattern": "def test_specs_by_package_groups_correctly(self) -> None:",
          "notes": "Tests registry grouping by package_name."
        }
      ],
      "adr_alignment": "aligned",
      "notes": "The registry implements the raw descriptor surface, but there is no unified package validation report that checks package metadata consistency before registration.",
      "validator_implication": "Development should report inconsistent package metadata and missing package grouping as errors; production install should block packages whose block descriptors cannot be reconciled with package metadata."
    },
    {
      "id": "PV-13-002",
      "section": "13_cross_surface_registry_consistency",
      "title": "Block entry-point scans are tolerant runtime discovery, not install validation",
      "contract": "The package validator must run block entry-point discovery in an isolated dry-run registry and convert unsupported return shapes, non-Block items, abstract blocks, duplicate capabilities, and callable failures into structured validation findings instead of relying on live startup warning-and-skip behavior.",
      "status": "partial",
      "severity": "error",
      "environments": [
        "development",
        "production"
      ],
      "validator_profile": {
        "development": "error",
        "production": "block"
      },
      "applicability": {
        "candidate_surfaces": [
          "cross_surface_registry_consistency"
        ],
        "trigger": "after_candidate_declared_surfaces_are_loaded_into_dry_run_registries",
        "not_applicable_result": "not_applicable"
      },
      "code_evidence": [
        {
          "path": "src/scistudio/blocks/registry/_scan.py",
          "kind": "contains",
          "pattern": "def _scan_tier2(registry: BlockRegistry) -> None:",
          "symbol": "_scan",
          "notes": "Mechanical inventory records the block registry scan module as the scan surface."
        },
        {
          "path": "src/scistudio/blocks/registry/_scan.py",
          "kind": "contains",
          "pattern": "block_eps: Any = (",
          "symbol": "_scan_tier2",
          "notes": "Tier-2 scan selects the scistudio.blocks entry-point group."
        },
        {
          "path": "src/scistudio/blocks/registry/_scan.py",
          "kind": "contains",
          "pattern": "Entry-point '%s' returned unsupported type: %s",
          "symbol": "_scan_tier2",
          "notes": "Invalid runtime entry points are logged and skipped."
        },
        {
          "path": "src/scistudio/blocks/registry/_scan.py",
          "kind": "contains",
          "pattern": "def _scan_monorepo_packages(registry: BlockRegistry) -> None:",
          "symbol": "_scan",
          "notes": "Development fallback mirrors package entry-point callable protocol."
        }
      ],
      "adr_evidence": [
        {
          "path": "docs/planning/package-validator-contract-survey-draft.md",
          "kind": "contains",
          "pattern": "Registry scan is tolerant by design.",
          "notes": "Draft distinguishes runtime tolerance from production install validation."
        },
        {
          "path": "docs/planning/package-validator-contract-survey-draft.md",
          "kind": "contains",
          "pattern": "isolated dry-run registry and atomic commit/quarantine semantics.",
          "notes": "Draft calls out dry-run registry requirement."
        }
      ],
      "tests": [
        {
          "path": "tests/blocks/test_registry.py",
          "kind": "contains",
          "pattern": "def test_entry_point_load_failure_logs_warning",
          "notes": "Runtime behavior currently logs and continues."
        },
        {
          "path": "tests/blocks/test_registry.py",
          "kind": "contains",
          "pattern": "def test_abstract_block_entry_point_logs_precise_warning",
          "notes": "Abstract blocks are skipped with a precise warning."
        }
      ],
      "adr_alignment": "aligned",
      "notes": "Current code is deliberately resilient at app startup; the package validator must be stricter and side-effect-free.",
      "validator_implication": "Validator implementations should instantiate temporary registries and classify each skipped entry point as a package validation finding, with production blocking invalid required package surfaces."
    },
    {
      "id": "PV-13-003",
      "section": "13_cross_surface_registry_consistency",
      "title": "Type registry discovery must reconcile package types with blocks and previewers",
      "contract": "A package validator must scan scistudio.types entry points into a dry-run TypeRegistry, validate returned DataObject subclasses and Meta constraints, and then use that registry to verify block port types, IO capability data_type values, and previewer target_type references.",
      "status": "partial",
      "severity": "error",
      "environments": [
        "development",
        "production"
      ],
      "validator_profile": {
        "development": "error",
        "production": "block"
      },
      "applicability": {
        "candidate_surfaces": [
          "cross_surface_registry_consistency"
        ],
        "trigger": "after_candidate_declared_surfaces_are_loaded_into_dry_run_registries",
        "not_applicable_result": "not_applicable"
      },
      "code_evidence": [
        {
          "path": "src/scistudio/core/types/registry.py",
          "kind": "contains",
          "pattern": "class TypeRegistry:",
          "symbol": "registry",
          "notes": "Mechanical inventory records the type registry module as the scan surface."
        },
        {
          "path": "src/scistudio/core/types/registry.py",
          "kind": "contains",
          "pattern": "def _scan_entrypoint_types(self) -> None:",
          "symbol": "_scan_entrypoint_types",
          "notes": "Type entry-point discovery is the package type scan hook."
        },
        {
          "path": "src/scistudio/core/types/registry.py",
          "kind": "contains",
          "pattern": "eps = importlib.metadata.entry_points(group=\"scistudio.types\")",
          "symbol": "_scan_entrypoint_types",
          "notes": "Registry scans the scistudio.types entry-point group."
        },
        {